{
  "id": "G-CBA-09",
  "title": "The same candidate pool scored physical and virtual",
  "asserts": "Same registry_version, different registry_hash, different scoring_mode. One rulebook, two models: conflating a mode with a version would mint a registry version per event shape. Scored twice by the runner's own cross-mode test, since a single-mode fixture cannot state a comparison.",
  "adr_proposals": [
    5,
    9
  ],
  "registry_version": "2.0.0-approved-oq-cba-004",
  "scoring_mode": "cba-physical-1",
  "request": {
    "description": "A panel on financial planning for small businesses.",
    "sectors": [
      "52"
    ],
    "roles": [
      "finance"
    ]
  },
  "candidates": [
    {
      "subject_id": "SYNTH-CBA-09-BOTH-MODES",
      "sector": "52",
      "role": "finance",
      "profile_present": true,
      "topic_text": "corporate treasury and financial planning",
      "city": "Pomona",
      "postal_code": "91768",
      "topic_score": 0.8,
      "topic_rationale": "Their recorded treasury work addresses the request's financial planning focus.",
      "distance_miles": 10.0
    }
  ],
  "expected": {
    "applied_weights": {
      "industry_match": 0.3,
      "role_match": 0.25,
      "cba_semantic_topic": 0.15,
      "proximity": 0.3
    },
    "scored_factor_keys": [
      "industry_match",
      "role_match",
      "cba_semantic_topic",
      "proximity"
    ],
    "ranking": [
      "SYNTH-CBA-09-BOTH-MODES"
    ],
    "candidates": {
      "SYNTH-CBA-09-BOTH-MODES": {
        "composite_state": "measured",
        "heuristic_score": 0.97,
        "is_shortlistable": true
      }
    }
  }
}
