{
  "id": "G-CBA-11",
  "title": "Measured Topic 0.45 against a policy_neutral Topic",
  "asserts": "B outranks A on the Topic factor — the ranking consequence of the neutral value, asserted rather than discovered. A speaker with no topic evidence ranks above one measured below 0.50. The subject ids are chosen so that lexicographic order would put A first, which makes the value ordering do the work.",
  "adr_proposals": [
    2
  ],
  "registry_version": "2.0.0-approved-oq-cba-004",
  "scoring_mode": "cba-physical-1",
  "request": {
    "description": "A panel on financial planning for small businesses.",
    "sectors": [
      "52"
    ],
    "roles": [
      "finance"
    ]
  },
  "candidates": [
    {
      "subject_id": "SYNTH-CBA-11-A-MEASURED",
      "sector": "52",
      "role": "finance",
      "profile_present": true,
      "topic_text": "corporate treasury and financial planning",
      "city": "Pomona",
      "postal_code": "91768",
      "topic_score": 0.45,
      "topic_rationale": "Their recorded treasury work addresses the request's financial planning focus.",
      "distance_miles": 10.0
    },
    {
      "subject_id": "SYNTH-CBA-11-B-NEUTRAL",
      "sector": "52",
      "role": "finance",
      "profile_present": true,
      "topic_text": null,
      "prior_talk": null,
      "city": "Pomona",
      "postal_code": "91768",
      "distance_miles": 10.0
    }
  ],
  "expected": {
    "applied_weights": {
      "industry_match": 0.3,
      "role_match": 0.25,
      "cba_semantic_topic": 0.15,
      "proximity": 0.3
    },
    "scored_factor_keys": [
      "industry_match",
      "role_match",
      "cba_semantic_topic",
      "proximity"
    ],
    "ranking": [
      "SYNTH-CBA-11-B-NEUTRAL",
      "SYNTH-CBA-11-A-MEASURED"
    ],
    "candidates": {
      "SYNTH-CBA-11-A-MEASURED": {
        "composite_state": "measured",
        "heuristic_score": 0.9175,
        "is_shortlistable": true,
        "factors": {
          "cba_semantic_topic": {
            "state": "measured",
            "value": 0.45,
            "zero_classification": null,
            "policy_id": null,
            "policy_version": null
          }
        }
      },
      "SYNTH-CBA-11-B-NEUTRAL": {
        "composite_state": "policy_neutral",
        "heuristic_score": 0.925,
        "is_shortlistable": true,
        "ui_caption": "Includes a neutral default for missing topic information.",
        "factors": {
          "cba_semantic_topic": {
            "state": "policy_neutral",
            "value": 0.5,
            "zero_classification": null,
            "policy_id": "cba-neutral-topic",
            "policy_version": "1.0.0",
            "ui_label": "Neutral — no topic information on file"
          }
        }
      }
    }
  }
}
