{
  "id": "G-CBA-08",
  "title": "A virtual event",
  "asserts": "Mode cba-virtual-1; no proximity factor in factor_scores at all; weights 0.428571 / 0.357143 / 0.214286 summing to 1.0. Proximity is absent from the model by an approved rule, known before any candidate is read — not unknown, and not zero.",
  "adr_proposals": [
    5,
    6,
    8
  ],
  "registry_version": "2.0.0-approved-oq-cba-004",
  "scoring_mode": "cba-virtual-1",
  "request": {
    "description": "A panel on financial planning for small businesses.",
    "sectors": [
      "52"
    ],
    "roles": [
      "finance"
    ]
  },
  "candidates": [
    {
      "subject_id": "SYNTH-CBA-08-VIRTUAL",
      "sector": "52",
      "role": "finance",
      "profile_present": true,
      "topic_text": "corporate treasury and financial planning",
      "city": "Pomona",
      "postal_code": "91768",
      "topic_score": 0.8,
      "topic_rationale": "Their recorded treasury work addresses the request's financial planning focus."
    }
  ],
  "expected": {
    "applied_weights": {
      "industry_match": 0.428571,
      "role_match": 0.357143,
      "cba_semantic_topic": 0.214286
    },
    "scored_factor_keys": [
      "industry_match",
      "role_match",
      "cba_semantic_topic"
    ],
    "ranking": [
      "SYNTH-CBA-08-VIRTUAL"
    ],
    "candidates": {
      "SYNTH-CBA-08-VIRTUAL": {
        "composite_state": "measured",
        "heuristic_score": 0.957143,
        "is_shortlistable": true,
        "unknown_factor_keys": [],
        "policy_neutral_factor_keys": [],
        "factors": {
          "industry_match": {
            "state": "measured",
            "value": 1.0,
            "zero_classification": null
          },
          "role_match": {
            "state": "measured",
            "value": 1.0,
            "zero_classification": null
          },
          "cba_semantic_topic": {
            "state": "measured",
            "value": 0.8,
            "zero_classification": null,
            "policy_id": null,
            "policy_version": null
          }
        }
      }
    }
  }
}
