{
  "id": "G-CBA-05",
  "title": "d = 25.0 miles exactly",
  "asserts": "Mid band, proximity 0.60 — the boundary ruling. Boundaries are lower-inclusive and upper-exclusive, so exactly 25 miles is a Mid distance and not a Near one.",
  "adr_proposals": [
    3
  ],
  "registry_version": "2.0.0-approved-oq-cba-004",
  "scoring_mode": "cba-physical-1",
  "request": {
    "description": "A panel on financial planning for small businesses.",
    "sectors": [
      "52"
    ],
    "roles": [
      "finance"
    ]
  },
  "candidates": [
    {
      "subject_id": "SYNTH-CBA-05-BOUNDARY",
      "sector": "52",
      "role": "finance",
      "profile_present": true,
      "topic_text": "corporate treasury and financial planning",
      "city": "Pomona",
      "postal_code": "91768",
      "topic_score": 0.8,
      "topic_rationale": "Their recorded treasury work addresses the request's financial planning focus.",
      "distance_miles": 25.0
    }
  ],
  "expected": {
    "applied_weights": {
      "industry_match": 0.3,
      "role_match": 0.25,
      "cba_semantic_topic": 0.15,
      "proximity": 0.3
    },
    "scored_factor_keys": [
      "industry_match",
      "role_match",
      "cba_semantic_topic",
      "proximity"
    ],
    "ranking": [
      "SYNTH-CBA-05-BOUNDARY"
    ],
    "candidates": {
      "SYNTH-CBA-05-BOUNDARY": {
        "composite_state": "measured",
        "heuristic_score": 0.85,
        "is_shortlistable": true,
        "unknown_factor_keys": [],
        "policy_neutral_factor_keys": [],
        "factors": {
          "industry_match": {
            "state": "measured",
            "value": 1.0,
            "zero_classification": null
          },
          "role_match": {
            "state": "measured",
            "value": 1.0,
            "zero_classification": null
          },
          "cba_semantic_topic": {
            "state": "measured",
            "value": 0.8,
            "zero_classification": null,
            "policy_id": null,
            "policy_version": null
          },
          "proximity": {
            "state": "measured",
            "value": 0.6,
            "zero_classification": null,
            "band": "mid",
            "ui_label": "Mid"
          }
        }
      }
    }
  }
}
